<xs:schema attributeFormDefault="unqualified" elementFormDefault="qualified" targetNamespace="http://finestmedia.ee/currencyconverter/generated" xmlns:xs="http://www.w3.org/2001/XMLSchema">
  <xs:element name="DataFeedSources">
    <xs:complexType>
      <xs:sequence>
        <xs:element name="DataFeedSource" maxOccurs="unbounded" minOccurs="0">
          <xs:complexType>
            <xs:sequence>
              <xs:element type="xs:string" name="id"/>
              <xs:element type="xs:string" name="displayName"/>
              <xs:element type="xs:boolean" name="enabled"/>
              <xs:element type="xs:string" name="url"/>
              <xs:element type="xs:string" name="dateFormat" minOccurs="0"/>
            </xs:sequence>
          </xs:complexType>
        </xs:element>
      </xs:sequence>
    </xs:complexType>
  </xs:element>
</xs:schema>